{
  "schema_version": "canonical_scene_v1",
  "scene_id": "source_clean_002__clean",
  "request_id": "source_clean_002__clean",
  "scene_type": "bedroom",
  "boundary": [
    [
      0.0,
      0.0
    ],
    [
      2.46,
      0.0
    ],
    [
      2.46,
      3.51
    ],
    [
      0.0,
      3.51
    ]
  ],
  "scene_height": 2.45,
  "objects": [
    {
      "id": "obj_000",
      "category": "cabinet",
      "description": "dark gray minimalist cabinet",
      "desc": "A dark gray two-drawer storage cabinet with minimalist design",
      "short_desc": "dark gray minimalist cabinet",
      "jid": "0_SM_Kitchen_top_60cm",
      "size": [
        0.78,
        0.5685,
        0.9345
      ],
      "center": [
        0.31,
        0.41,
        0.47
      ],
      "rotation": [
        0.0,
        0.0,
        90.0
      ],
      "geometry_provenance": "asset_mesh",
      "asset_ref": {
        "source_db": "imaginarium",
        "asset_key": "0_SM_Kitchen_top_60cm",
        "mesh_uri": null,
        "pointcloud_uri": null,
        "metadata_uri": null
      },
      "asset_proxy": {
        "type": "obb_from_source_scene",
        "bbox_center_local": [
          0.0,
          0.0,
          0.0
        ],
        "bbox_size": [
          0.78,
          0.5685,
          0.9345
        ]
      },
      "metadata": {
        "source_scene_id": "scene_003309_01",
        "source_object_index": 0,
        "fixture_role": "frozen_source_object",
        "interactive": false
      }
    },
    {
      "id": "obj_001",
      "category": "cabinet",
      "description": "dark gray minimalist cabinet",
      "desc": "A dark gray two-drawer storage cabinet with minimalist design",
      "short_desc": "dark gray minimalist cabinet",
      "jid": "0_SM_Kitchen_top_60cm",
      "size": [
        0.78,
        0.5685,
        0.9345
      ],
      "center": [
        0.31,
        3.1,
        0.47
      ],
      "rotation": [
        0.0,
        0.0,
        90.0
      ],
      "geometry_provenance": "asset_mesh",
      "asset_ref": {
        "source_db": "imaginarium",
        "asset_key": "0_SM_Kitchen_top_60cm",
        "mesh_uri": null,
        "pointcloud_uri": null,
        "metadata_uri": null
      },
      "asset_proxy": {
        "type": "obb_from_source_scene",
        "bbox_center_local": [
          0.0,
          0.0,
          0.0
        ],
        "bbox_size": [
          0.78,
          0.5685,
          0.9345
        ]
      },
      "metadata": {
        "source_scene_id": "scene_003309_01",
        "source_object_index": 1,
        "fixture_role": "frozen_source_object",
        "interactive": false
      }
    },
    {
      "id": "obj_002",
      "category": "bed",
      "description": "gray wooden single bed",
      "desc": "Single bed with gray bedding and dark brown wooden headboard",
      "short_desc": "gray wooden single bed",
      "jid": "b_60",
      "size": [
        1.868,
        2.238,
        1.1
      ],
      "center": [
        1.32,
        1.75,
        0.55
      ],
      "rotation": [
        0.0,
        0.0,
        90.0
      ],
      "geometry_provenance": "asset_mesh",
      "asset_ref": {
        "source_db": "imaginarium",
        "asset_key": "b_60",
        "mesh_uri": null,
        "pointcloud_uri": null,
        "metadata_uri": null
      },
      "asset_proxy": {
        "type": "obb_from_source_scene",
        "bbox_center_local": [
          0.0,
          0.0,
          0.0
        ],
        "bbox_size": [
          1.868,
          2.238,
          1.1
        ]
      },
      "metadata": {
        "source_scene_id": "scene_003309_01",
        "source_object_index": 2,
        "fixture_role": "frozen_source_object",
        "interactive": false
      }
    },
    {
      "id": "obj_003",
      "category": "box",
      "description": "dark wooden storage box",
      "desc": "Dark brown wooden storage box with lid and handwritten label",
      "short_desc": "dark wooden storage box",
      "jid": "a_SM_Indoor_Props_01c",
      "size": [
        0.558,
        0.5535,
        0.4966
      ],
      "center": [
        1.08,
        0.42,
        0.25
      ],
      "rotation": [
        0.0,
        0.0,
        90.0
      ],
      "geometry_provenance": "asset_mesh",
      "asset_ref": {
        "source_db": "imaginarium",
        "asset_key": "a_SM_Indoor_Props_01c",
        "mesh_uri": null,
        "pointcloud_uri": null,
        "metadata_uri": null
      },
      "asset_proxy": {
        "type": "obb_from_source_scene",
        "bbox_center_local": [
          0.0,
          0.0,
          0.0
        ],
        "bbox_size": [
          0.558,
          0.5535,
          0.4966
        ]
      },
      "metadata": {
        "source_scene_id": "scene_003309_01",
        "source_object_index": 3,
        "fixture_role": "frozen_source_object",
        "interactive": false
      }
    },
    {
      "id": "obj_004",
      "category": "box",
      "description": "dark wooden storage box",
      "desc": "Dark brown wooden storage box with lid and handwritten label",
      "short_desc": "dark wooden storage box",
      "jid": "a_SM_Indoor_Props_01c",
      "size": [
        0.558,
        0.5535,
        0.4966
      ],
      "center": [
        1.09,
        3.1,
        0.25
      ],
      "rotation": [
        0.0,
        0.0,
        90.0
      ],
      "geometry_provenance": "asset_mesh",
      "asset_ref": {
        "source_db": "imaginarium",
        "asset_key": "a_SM_Indoor_Props_01c",
        "mesh_uri": null,
        "pointcloud_uri": null,
        "metadata_uri": null
      },
      "asset_proxy": {
        "type": "obb_from_source_scene",
        "bbox_center_local": [
          0.0,
          0.0,
          0.0
        ],
        "bbox_size": [
          0.558,
          0.5535,
          0.4966
        ]
      },
      "metadata": {
        "source_scene_id": "scene_003309_01",
        "source_object_index": 4,
        "fixture_role": "frozen_source_object",
        "interactive": false
      }
    }
  ],
  "metadata": {
    "coordinate_frame": {
      "origin": "room_min_corner_floor",
      "axes": "x_width_y_depth_z_up",
      "unit": "meter",
      "rotation_unit": "degree"
    },
    "source_scene_id": "scene_003309_01",
    "source_selection": "strict_zero_candidate_collision_oob_support_screen",
    "generator_skipped": true,
    "base_case_id": "source_clean_002",
    "variant_family": "clean"
  }
}
